{
	"$schema": "https://json-schema.org/draft/2020-12/schema",
	"$id": "file:///.codex/agent-output-auditor-read-only.schema.json",
	"title": "Codex Auditor Output (Read Only)",
	"description": "Structural schema for auditor outputs that report completion of read_only subtasks. Read-only workflows may dispatch Operator slices; Coder is reserved for code_change work.",
	"type": "object",
	"required": [
		"ssot_id",
		"protocol_version",
		"task_id",
		"subtask_id",
		"agent_type",
		"workflow_mode",
		"routing_mode",
		"slice_id",
		"coder_subtask_ids",
		"operator_subtask_ids",
		"parallel_peak_inflight",
		"audit_phases",
		"diff_review",
		"status",
		"blocked",
		"rationale",
		"review_only",
		"blocking_reason",
		"allowed_paths",
		"review_loop"
	],
	"$defs": {
		"finding": {
			"type": "object",
			"required": ["severity", "title", "details", "action_required"],
			"properties": {
				"severity": {
					"type": "string",
					"enum": ["critical", "important", "minor"]
				},
				"title": {
					"type": "string",
					"minLength": 1
				},
				"details": {
					"type": "string",
					"minLength": 1
				},
				"action_required": {
					"type": "boolean"
				}
			},
			"additionalProperties": false
		},
		"audit_phase_base": {
			"type": "object",
			"required": ["phase", "status", "findings", "evidence"],
			"properties": {
				"phase": {
					"type": "string",
					"enum": ["spec", "quality"]
				},
				"status": {
					"type": "string",
					"enum": ["pass", "fail"]
				},
				"findings": {
					"type": "array",
					"items": {
						"$ref": "#/$defs/finding"
					}
				},
				"evidence": {
					"type": "string",
					"minLength": 1
				}
			},
			"additionalProperties": false
		},
		"audit_phase_spec": {
			"allOf": [
				{
					"$ref": "#/$defs/audit_phase_base"
				},
				{
					"properties": {
						"phase": {
							"const": "spec"
						}
					}
				}
			]
		},
		"audit_phase_quality": {
			"allOf": [
				{
					"$ref": "#/$defs/audit_phase_base"
				},
				{
					"properties": {
						"phase": {
							"const": "quality"
						}
					}
				}
			]
		}
	},
	"properties": {
		"ssot_id": {
			"type": "string",
			"minLength": 1
		},
		"protocol_version": {
			"type": "string",
			"const": "2.0"
		},
		"task_id": {
			"type": "string",
			"minLength": 1
		},
		"subtask_id": {
			"type": "string",
			"minLength": 1
		},
		"agent_type": {
			"type": "string",
			"const": "auditor"
		},
		"workflow_mode": {
			"type": "string",
			"enum": ["parallel_dispatch", "subagent_task_execution", "mixed"]
		},
		"routing_mode": {
			"type": "string",
			"const": "assistant_nested"
		},
		"slice_id": {
			"type": "string",
			"minLength": 1
		},
		"coder_subtask_ids": {
			"type": "array",
			"items": {
				"type": "string",
				"minLength": 1
			}
		},
		"operator_subtask_ids": {
			"type": "array",
			"items": {
				"type": "string",
				"minLength": 1
			}
		},
		"parallel_peak_inflight": {
			"type": "integer",
			"minimum": 0
		},
		"audit_phases": {
			"type": "array",
			"minItems": 2,
			"maxItems": 2,
			"prefixItems": [
				{
					"$ref": "#/$defs/audit_phase_spec"
				},
				{
					"$ref": "#/$defs/audit_phase_quality"
				}
			],
			"items": false
		},
		"diff_review": {
			"type": "object",
			"required": ["status", "base_ref", "head_ref", "command", "evidence"],
			"properties": {
				"status": {
					"type": "string",
					"enum": ["pass", "fail", "not_applicable"]
				},
				"base_ref": {
					"type": "string",
					"minLength": 1
				},
				"head_ref": {
					"type": "string",
					"minLength": 1
				},
				"command": {
					"type": "string",
					"minLength": 1
				},
				"evidence": {
					"type": "string",
					"minLength": 1
				}
			},
			"additionalProperties": false
		},
		"status": {
			"type": "string",
			"enum": ["in_progress", "done", "awaiting_review"]
		},
		"blocked": {
			"type": "boolean"
		},
		"rationale": {
			"type": "string",
			"minLength": 1
		},
		"review_only": {
			"type": "boolean"
		},
		"blocking_reason": {
			"type": "string",
			"minLength": 1
		},
		"allowed_paths": {
			"type": "array",
			"minItems": 1,
			"items": {
				"type": "string",
				"minLength": 1,
				"pattern": "^(/|web:|repo:)"
			}
		},
		"review_loop": {
			"type": "object",
			"required": [
				"policy",
				"auditor_passes",
				"orchestrator_self_passes",
				"converged",
				"new_issues_found_in_last_audit_pass",
				"escalation_reason"
			],
			"properties": {
				"policy": {
					"type": "string",
					"const": "adaptive_min2_max3_second_pass_stable"
				},
				"auditor_passes": {
					"type": "integer",
					"minimum": 2,
					"maximum": 3
				},
				"orchestrator_self_passes": {
					"type": "integer",
					"minimum": 2
				},
				"converged": {
					"type": "boolean"
				},
				"new_issues_found_in_last_audit_pass": {
					"type": "boolean"
				},
				"escalation_reason": {
					"type": "string",
					"minLength": 1
				}
			},
			"additionalProperties": false
		}
	},
	"allOf": [
		{
			"oneOf": [
				{
					"properties": {
						"status": {
							"const": "awaiting_review"
						},
						"blocked": {
							"const": true
						}
					}
				},
				{
					"allOf": [
						{
							"properties": {
								"status": {
									"enum": ["in_progress", "done"]
								}
							}
						},
						{
							"properties": {
								"blocked": {
									"const": false
								}
							}
						}
					]
				}
			]
		},
		{
			"if": { "properties": { "blocked": { "const": false } } },
			"then": { "properties": { "blocking_reason": { "const": "not_applicable" } } }
		},
		{
			"if": { "properties": { "blocked": { "const": true } } },
			"then": {
				"properties": { "blocking_reason": { "not": { "const": "not_applicable" } } }
			}
		},
		{
			"if": { "properties": { "status": { "const": "done" } } },
			"then": {
				"properties": {
					"review_loop": { "properties": { "converged": { "const": true } } }
				}
			}
		}
	],
	"examples": [
		{
			"ssot_id": "dev-2026-02-22",
			"protocol_version": "2.0",
			"task_id": "task-brief-001",
			"subtask_id": "s1-brief",
			"agent_type": "auditor",
			"workflow_mode": "parallel_dispatch",
			"routing_mode": "assistant_nested",
			"slice_id": "slice-audit-prework-a",
			"coder_subtask_ids": [],
			"operator_subtask_ids": ["op-brief-1"],
			"parallel_peak_inflight": 0,
			"audit_phases": [
				{
					"phase": "spec",
					"status": "pass",
					"findings": [],
					"evidence": "Spec: read-only brief meets deliverable requirements."
				},
				{
					"phase": "quality",
					"status": "pass",
					"findings": [],
					"evidence": "Quality: brief is clear and actionable."
				}
			],
			"diff_review": {
				"status": "not_applicable",
				"base_ref": "not_applicable",
				"head_ref": "not_applicable",
				"command": "not_applicable",
				"evidence": "Diff review not applicable for read-only brief."
			},
			"status": "done",
			"blocked": false,
			"rationale": "REVIEW_ONLY: Audit prework completed.",
			"review_only": true,
			"blocking_reason": "not_applicable",
			"allowed_paths": ["/abs/runtime/.codex/dispatch-preflight.schema.json"],
			"review_loop": {
				"policy": "adaptive_min2_max3_second_pass_stable",
				"auditor_passes": 2,
				"orchestrator_self_passes": 2,
				"converged": true,
				"new_issues_found_in_last_audit_pass": false,
				"escalation_reason": "none"
			}
		}
	],
	"additionalProperties": false
}
